Sheet: Sheet1
D6: Инвестиции,млн.руб | E6: Прирост выпуска продукции,млн.руб | L6: c/x | M6: 0 | N6: 50 | O6: 100 | P6: 150 | Q6: 200 | R6: 250 | S6: B2 | T6: X2
E7: П1 | F7: П2 | G7: П3 | H7: П4 | L7: 0 | M7: of:=0+0 -> 0 | S7: of:=MAX([.M7:.R7]) -> 0 | T7: 0
D8: 50 | E8: 9 | F8: 10 | G8: 7 | H8: 8 | L8: 50 | M8: 9 | N8: 10 | S8: of:=MAX([.M8:.R8]) -> 10 | T8: 50
D9: 100 | E9: 15 | F9: 16 | G9: 13 | H9: 14 | L9: 100 | M9: 15 | N9: of:=[.$N$8]+[.M8] -> 19 | O9: 16 | S9: of:=MAX([.M9:.R9]) -> 19 | T9: 50
D10: 150 | E10: 24 | F10: 22 | G10: 20 | H10: 21 | L10: 150 | M10: 24 | N10: of:=[.$N$8]+[.M9] -> 25 | O10: of:=[.$O$9]+[.M8] -> 25 | P10: 22 | S10: of:=MAX([.M10:.R10]) -> 25 | T10: 50
D11: 200 | E11: 33 | F11: 34 | G11: 31 | H11: 32 | L11: 200 | M11: 33 | N11: of:=[.$N$8]+[.M10] -> 34 | O11: of:=[.$O$9]+[.M9] -> 31 | P11: of:=[.$P$10] + [.M8] -> 31 | Q11: 34 | S11: of:=MAX([.M11:.R11]) -> 34 | T11: 50
D12: 250 | E12: 40 | F12: 39 | G12: 41 | H12: 40 | L12: 250 | M12: 40 | N12: of:=[.$N$8]+[.M11] -> 43 | O12: of:=[.$O$9]+[.M10] -> 40 | P12: of:=[.$P$10] + [.M9] -> 37 | Q12: of:=[.$Q$11] + [.M8] -> 43 | R12: 39 | S12: of:=MAX([.M12:.R12]) -> 43 | T12: 200
D14: x1* | E14: 50 | F14: 100 | G14: 150 | H14: 200 | I14: 250
D15: b1 | E15: 9 | F15: 15 | G15: 24 | H15: 33 | I15: 40
L17: c/x | M17: 0 | N17: 50 | O17: 100 | P17: 150 | Q17: 200 | R17: 250 | S17: B3 | T17: X3
L18: 0 | M18: of:=0+0 -> 0 | S18: of:=MAX([.M18:.R18]) -> 0 | T18: 0
L19: 50 | M19: 10 | N19: 7 | S19: of:=MAX([.M19:.R19]) -> 10 | T19: 0
L20: 100 | M20: 16 | N20: of:=[.$N$19]+[.M19] -> 17 | O20: 13 | S20: of:=MAX([.M20:.R20]) -> 17 | T20: 50
D21: C | E21: 0 | F21: 50 | G21: 100 | H21: 150 | I21: 200 | J21: 250 | L21: 150 | M21: 22 | N21: of:=[.$N$8]+[.M20] -> 26 | O21: of:=[.$O$20]+[.M19] -> 23 | P21: 20 | S21: of:=MAX([.M21:.R21]) -> 26 | T21: 50
D22: B1 | E22: 0 | F22: 9 | G22: 15 | H22: 24 | I22: 33 | J22: 40 | L22: 200 | M22: 34 | N22: of:=[.$N$8]+[.M21] -> 32 | O22: of:=[.$O$9]+[.M20] -> 32 | P22: of:=[.$P$210] +[.M19] -> 10 | Q22: 31 | S22: of:=MAX([.M22:.R22]) -> 34 | T22: 0
D23: X1 | E23: 0 | F23: 50 | G23: 100 | H23: 150 | I23: 200 | J23: 250 | L23: 250 | M23: 39 | N23: of:=[.$N$8]+[.M22] -> 44 | O23: of:=[.$O$9]+[.M21] -> 38 | P23: of:=[.$P$10] + [.M20] -> 38 | Q23: of:=[.$Q$22]+ [.M19] -> 41 | R23: 41 | S23: of:=MAX([.M23:.R23]) -> 44 | T23: 50
D24: B2 | E24: 0 | F24: 10 | G24: 19 | H24: 25 | I24: 34 | J24: 43
D25: X2 | E25: 0 | F25: 50 | G25: 50 | H25: 50 | I25: 50 | J25: 200
D26: B3 | E26: 0 | F26: 10 | G26: 17 | H26: 26 | I26: 34 | J26: 44 | L26: c/x | M26: 0 | N26: 50 | O26: 100 | P26: 150 | Q26: 200 | R26: 250 | S26: B3 | T26: X3
D27: X3 | E27: 0 | F27: 0 | G27: 50 | H27: 50 | I27: -0 | J27: 50 | L27: 0 | M27: of:=0+0 -> 0 | S27: of:=MAX([.M27:.R27]) -> 0 | T27: 0
D28: B4 | E28: 0 | F28: 8 | G28: 15 | H28: 23 | I28: 33 | J28: 41 | L28: 50 | M28: 7 | N28: 8 | S28: of:=MAX([.M28:.R28]) -> 8 | T28: 50
D29: X4 | E29: 0 | F29: 50 | G29: 50 | H29: 50 | I29: 100 | J29: 50 | L29: 100 | M29: 13 | N29: of:=[.$N$28]+[.M28] -> 15 | O29: 14 | S29: of:=MAX([.M29:.R29]) -> 15 | T29: 50
L30: 150 | M30: 20 | N30: of:=[.$N$8]+[.M29] -> 23 | O30: of:=[.$O$20]+[.M28] -> 20 | P30: 21 | S30: of:=MAX([.M30:.R30]) -> 23 | T30: 50
L31: 200 | M31: 31 | N31: of:=[.$N$8]+[.M30] -> 30 | O31: of:=[.$O$30]+[.M29] -> 33 | P31: of:=[.$P$210] +[.M28] -> 7 | Q31: 32 | S31: of:=MAX([.M31:.R31]) -> 33 | T31: 100
L32: 250 | M32: 41 | N32: of:=[.$N$8]+[.M31] -> 41 | O32: of:=[.$O$9]+[.M30] -> 36 | P32: of:=[.$P$31] + [.M29] -> 20 | Q32: of:=[.$Q$31]+ [.M28] -> 39 | R32: 40 | S32: of:=MAX([.M32:.R32]) -> 41 | T32: 50